{
  "schema_version": "semantic-okf-harbor-campaign-bindings/1.0",
  "campaign_id": "20260716-pi-spark-one-evolution-pilot",
  "external_gates": {
    "adaptive": {
      "deterministic_retrieval_no_regression": true
    },
    "classical": {
      "deterministic_retrieval_no_regression": true
    },
    "embeddings": {
      "deterministic_retrieval_no_regression": true
    },
    "ensemble": {
      "deterministic_retrieval_no_regression": true
    },
    "entity-graph": {
      "deterministic_retrieval_no_regression": true
    },
    "legacy": {
      "deterministic_retrieval_no_regression": true
    }
  },
  "excluded_runs": [
    {
      "result_root": "results/20260716-baseline-dev-classical-q032",
      "category": "pre_fix_grader",
      "reason": "This run predates the EOF-normalization grader repair; the corresponding grader-r1 run is authoritative."
    },
    {
      "result_root": "results/20260716-baseline-dev-embeddings-q032",
      "category": "pre_fix_grader",
      "reason": "This run predates the EOF-normalization grader repair; the corresponding grader-r1 run is authoritative."
    },
    {
      "result_root": "results/20260716-baseline-dev-legacy-q032",
      "category": "pre_agent_auth_failure",
      "reason": "Pi exited before agent execution because the ephemeral OpenAI Codex authentication mount was unavailable; the authenticated grader-r1 run is authoritative."
    },
    {
      "result_root": "results/20260716-baseline-dev-legacy-q032-auth-r1",
      "category": "pre_fix_grader",
      "reason": "This authenticated run predates the EOF-normalization grader repair; the corresponding grader-r1 run is authoritative."
    },
    {
      "result_root": "results/20260716-evolved-dev-classical-q032",
      "category": "pre_fix_grader",
      "reason": "This run predates the EOF-normalization grader repair; the corresponding grader-r1 run is authoritative."
    },
    {
      "result_root": "results/20260716-evolved-dev-embeddings-q032",
      "category": "pre_fix_grader",
      "reason": "This run predates the EOF-normalization grader repair; the corresponding grader-r1 run is authoritative."
    },
    {
      "result_root": "results/20260716-evolved-dev-legacy-q032",
      "category": "pre_agent_auth_failure",
      "reason": "Pi exited before agent execution because the ephemeral OpenAI Codex authentication mount was unavailable; the authenticated grader-r1 run is authoritative."
    },
    {
      "result_root": "results/20260716-evolved-dev-legacy-q032-auth-r1",
      "category": "pre_fix_grader",
      "reason": "This authenticated run predates the EOF-normalization grader repair; the corresponding grader-r1 run is authoritative."
    },
    {
      "result_root": "results/20260716-evolved-train-ensemble-q031",
      "category": "pre_agent_auth_failure",
      "reason": "Pi exited before agent execution because the ephemeral OpenAI Codex authentication mount was unavailable; the auth-r1 run is authoritative."
    },
    {
      "result_root": "results/20260716-evolved-train-ensemble-q031-auth-r2",
      "category": "delayed_duplicate",
      "reason": "This redundant delayed retry never produced a terminal trial result; the completed auth-r1 run is authoritative."
    },
    {
      "result_root": "results/20260716-evolved-train-entity-graph-q031",
      "category": "pre_agent_auth_failure",
      "reason": "Pi exited before agent execution because the ephemeral OpenAI Codex authentication mount was unavailable; the auth-r1 run is authoritative."
    }
  ],
  "entries": [
    {
      "family": "legacy",
      "generation": "baseline",
      "cohort": "train",
      "question_id": "q031",
      "result_root": "results/20260716-baseline-smoke-legacy-q031",
      "job_result_sha256": "d4e0485c497bc3ace682fe2cfc36f0290c721e0c26b0c811b292106addcd8b6f",
      "job_lock_sha256": "9610c016fb538d06d44d68da2d5f2d0b9a5a0933e2e76246e2e45497f4956652",
      "trial_relative_dir": "q031__eQKCvsJ",
      "trial_result_sha256": "765414a1b19afed1cfcd5aa9fbc78cf6e22059f28fa1ff39a255b95f75a996c8",
      "trial_lock_sha256": "6c6806cd1337b8638a6fa9876f408400f08f24dccc70fddbc4866f8aebf39655"
    },
    {
      "family": "legacy",
      "generation": "evolved",
      "cohort": "train",
      "question_id": "q031",
      "result_root": "results/20260716-evolved-train-legacy-q031",
      "job_result_sha256": "5faaad19c87e5944a1f12dad08e8f96b5b418826e80975386671ce93ff0df1af",
      "job_lock_sha256": "a7763cd8621f5284ea310c48b899f7206649e36b2cc6c23a44780e67927a6f07",
      "trial_relative_dir": "q031__xVidSzH",
      "trial_result_sha256": "ec92e7efd2466e5c575a31275c41f5e3beb28b40a529dad88eaa68be0f15dcb2",
      "trial_lock_sha256": "82f027eed01ba3f9fa4623d37b9cf978930870f5b3191fa48f97efd86dd08f78"
    },
    {
      "family": "embeddings",
      "generation": "baseline",
      "cohort": "train",
      "question_id": "q031",
      "result_root": "results/20260716-baseline-smoke-embeddings-q031",
      "job_result_sha256": "6c8921469404820cc5f89ae9e3fe9089cd569e054e0ec63128d78a52977397a0",
      "job_lock_sha256": "25e6dd52c95049c577b00fdf77cf765efb40c254e8d7b63c55b8a9f6f9f198f2",
      "trial_relative_dir": "q031__mG6oSUM",
      "trial_result_sha256": "f34947c0a3a884ee06526866a26e741489c294bf9e271364f5c6325f32a05c34",
      "trial_lock_sha256": "b2b600ef52e465fbccef6abacf0e37928184b002b574a08226f2382c05c8962d"
    },
    {
      "family": "embeddings",
      "generation": "evolved",
      "cohort": "train",
      "question_id": "q031",
      "result_root": "results/20260716-evolved-train-embeddings-q031",
      "job_result_sha256": "cf16cf388d69081b8a57e7465baf45dd48339202ef11131c6a5651e13e9da597",
      "job_lock_sha256": "5ce8d457be9fb45794b7c5d6256e92ff8eb449852e5943d3369b576709bdf5f5",
      "trial_relative_dir": "q031__FbEpHfa",
      "trial_result_sha256": "1f5e43ac2d92b84ff70353c8e3cb235c9f7baaae6083b57e2e3670efc3ab6451",
      "trial_lock_sha256": "550a3cff725bf7aca79a90edcf9a12004697b78ba3784bd94eee18837825b37d"
    },
    {
      "family": "classical",
      "generation": "baseline",
      "cohort": "train",
      "question_id": "q031",
      "result_root": "results/20260716-baseline-smoke-classical-q031",
      "job_result_sha256": "2018bfb22b678dd1677b6a06126f7a46cd28dbca4dc444eca7f4895bf9031a4c",
      "job_lock_sha256": "b37a5329fd7d173407fe04df1ff1a14a68e694ccd2c548b0fe0c9d0e8a4894d5",
      "trial_relative_dir": "q031__nSA8NQA",
      "trial_result_sha256": "c5b64e54803cbae0002c39d987f0123fd991ea2b5632ca2b5d0027303ee3acf2",
      "trial_lock_sha256": "4604dc7b0b84dc988dd9557a0b2db90b26ab44a7cf3dc6086e828d4e23ea4355"
    },
    {
      "family": "classical",
      "generation": "evolved",
      "cohort": "train",
      "question_id": "q031",
      "result_root": "results/20260716-evolved-train-classical-q031",
      "job_result_sha256": "174c0ecc8ba3491bbfbf4f395a18125556b0d5f0bfb673dcf43507e245e314b9",
      "job_lock_sha256": "747acc805536bd8ffde26fd63a04e3deab73357649be023e07c6463b5b178282",
      "trial_relative_dir": "q031__6Nyit4M",
      "trial_result_sha256": "00aef602d9a5776a8809fc0d94dc80eead8d0e66757461d11e431afb028b9004",
      "trial_lock_sha256": "6b433ef1446cdaeacd235d2d804316821cd051cc3ec4387115f8d4bf8e25158d"
    },
    {
      "family": "adaptive",
      "generation": "baseline",
      "cohort": "train",
      "question_id": "q031",
      "result_root": "results/20260716-baseline-smoke-adaptive-q031",
      "job_result_sha256": "46322a131d7cac1782ba35a7135ef5d7196ebeab9f2f397c7bbb73255ee73c51",
      "job_lock_sha256": "23abc304b40abbcbfc8b759016252b1888d83644f890fd773c89b7e8a6751bc7",
      "trial_relative_dir": "q031__ubMPbJd",
      "trial_result_sha256": "844780df7de140fc1ac50f9729485aec8a6d8f32f46247ab80c6d89613998167",
      "trial_lock_sha256": "5b767aa510e5a3eff3fbe473a77be32f98d1142b98c189b0d37eef8caab698b3"
    },
    {
      "family": "adaptive",
      "generation": "evolved",
      "cohort": "train",
      "question_id": "q031",
      "result_root": "results/20260716-evolved-train-adaptive-q031",
      "job_result_sha256": "ba00ad86f16970221c0c67600c3dac3e08792af07bdb35ccd813533bcb8dd1fb",
      "job_lock_sha256": "aa7f7b0d9b9a2ddcf85c487c3632a269afb3374be7b90f166753ccfb9d0b8881",
      "trial_relative_dir": "q031__DdjMH2e",
      "trial_result_sha256": "27a13695c54044a826ef02e808f11c0e9a1c6f0f199baab83b44bbe663452e88",
      "trial_lock_sha256": "376b02f91ce41fd8faef07e8307e1be73910f231ce7adbe9f348bbac2bb0b70b"
    },
    {
      "family": "entity-graph",
      "generation": "baseline",
      "cohort": "train",
      "question_id": "q031",
      "result_root": "results/20260716-baseline-smoke-entity-graph-q031",
      "job_result_sha256": "4fcc6ef7ac0a5b67bb29c2087ee380fed13a1fc3dc2fbea585f2b161c639b3b1",
      "job_lock_sha256": "8069d81cc2fc3d8f19b5e02aae2f15f75c3d0329ed71d42d510bee3edb4033c5",
      "trial_relative_dir": "q031__UqPrUKk",
      "trial_result_sha256": "dadc43b56904665e4df9e7f0300a168384eba36152aebc18477a52370e402701",
      "trial_lock_sha256": "5aa51a2c50a458218e26f25e49b59c2eb41360bf470adea405a2d2c48053802d"
    },
    {
      "family": "entity-graph",
      "generation": "evolved",
      "cohort": "train",
      "question_id": "q031",
      "result_root": "results/20260716-evolved-train-entity-graph-q031-auth-r1",
      "job_result_sha256": "53d292c07321f4ac78f6758a8d7c30b97a2f34099c05c29062dd97a3da39d7ca",
      "job_lock_sha256": "6184d07cb6bf979d050bf41bdec195431a2d37ab9ccf96075ed870de8c5aac95",
      "trial_relative_dir": "q031__MNFVPvx",
      "trial_result_sha256": "be56f627b5f4fcd233ae044e5714c10445d7172849eb4a719a9389a9e4636cca",
      "trial_lock_sha256": "99597655798521a29609bb66b111bf423a2dc3a9ddc659ec3a006a20d5affda5"
    },
    {
      "family": "ensemble",
      "generation": "baseline",
      "cohort": "train",
      "question_id": "q031",
      "result_root": "results/20260716-baseline-smoke-ensemble-q031",